{
  "$schema": "../schemas/canon-pack.schema.json",
  "schema_version": "1.0.0",
  "pack_id": "demo-unrelated-history",
  "pack_version": "1.0.0",
  "title": "Unrelated History — Synthetic Retrieval Example",
  "language": "en",
  "description": "Complete fictional pack extending the harbor demo with an unrelated market destruction and an archive key loan/return. Tests history retrieval by causality OR mention and persistent state independently of anchors. No real franchise canon.",
  "calendar": {
    "system": "relative_day",
    "origin_label": "Day 0 of the fictional harbor story",
    "day_length_minutes": 1440,
    "time_zone_label": "Harbor local time",
    "notes": "Binding maps day 0 to a chosen story-calendar display date. No real-world clock is used."
  },
  "coverage": {
    "start": {
      "day": 0,
      "minute": 480
    },
    "end": {
      "day": 5,
      "minute": 1439
    },
    "notes": "Finite demonstration coverage only."
  },
  "sources": [
    {
      "id": "example-source",
      "title": "Invented implementation fixture",
      "locator": "This handoff package / examples/unrelated-history.canon.json",
      "kind": "example",
      "notes": "Not a source for any published fictional world."
    }
  ],
  "predicates": [
    {
      "id": "exists",
      "description": "Whether the entity physically exists.",
      "value_type": "boolean"
    },
    {
      "id": "alive",
      "description": "Whether a person is alive.",
      "value_type": "boolean"
    },
    {
      "id": "active",
      "description": "Whether a conflict is currently ongoing.",
      "value_type": "boolean"
    },
    {
      "id": "victor",
      "description": "The organization that won the completed conflict.",
      "value_type": "entity_ref"
    },
    {
      "id": "broadcast",
      "description": "Whether the council broadcast has occurred.",
      "value_type": "boolean"
    },
    {
      "id": "festival_held",
      "description": "Whether the harbor festival has occurred.",
      "value_type": "boolean"
    },
    {
      "id": "condition",
      "description": "Physical condition of the identified place or object.",
      "value_type": "string",
      "allowed_values": [
        "intact",
        "destroyed"
      ]
    },
    {
      "id": "holder",
      "description": "Established current custodian of the identified object.",
      "value_type": "entity_ref"
    }
  ],
  "entities": [
    {
      "id": "planet",
      "name": "The planet",
      "aliases": [],
      "kind": "world",
      "static_description": "The physical world containing the harbor.",
      "source_refs": [
        "example-source"
      ]
    },
    {
      "id": "harbor",
      "name": "Harbor",
      "aliases": [],
      "kind": "place",
      "static_description": "A coastal city with trade and civic institutions.",
      "source_refs": [
        "example-source"
      ]
    },
    {
      "id": "mira",
      "name": "Mira",
      "aliases": [
        "Doctor Mira"
      ],
      "kind": "person",
      "static_description": "A medic trained in emergency care.",
      "source_refs": [
        "example-source"
      ]
    },
    {
      "id": "union",
      "name": "The Union",
      "aliases": [],
      "kind": "organization",
      "static_description": "A political coalition with military resources.",
      "source_refs": [
        "example-source"
      ]
    },
    {
      "id": "council",
      "name": "The Council",
      "aliases": [],
      "kind": "organization",
      "static_description": "A rival political institution.",
      "source_refs": [
        "example-source"
      ]
    },
    {
      "id": "conflict",
      "name": "The harbor conflict",
      "aliases": [],
      "kind": "other",
      "static_description": "An event entity used to track conflict status.",
      "source_refs": [
        "example-source"
      ]
    },
    {
      "id": "old-market",
      "name": "Old Market",
      "aliases": [
        "旧市场",
        "Old Bazaar"
      ],
      "kind": "place",
      "static_description": "A named trading site in Harbor. Physical condition and operating status are temporal facts.",
      "source_refs": [
        "example-source"
      ]
    },
    {
      "id": "archive-key",
      "name": "Archive Key",
      "aliases": [
        "档案室钥匙"
      ],
      "kind": "object",
      "static_description": "The uniquely identified key associated with the local archive.",
      "source_refs": [
        "example-source"
      ]
    },
    {
      "id": "archivist",
      "name": "Archivist",
      "aliases": [
        "档案管理员"
      ],
      "kind": "person",
      "static_description": "The archivist associated with the local archive.",
      "source_refs": [
        "example-source"
      ]
    },
    {
      "id": "courier",
      "name": "Courier",
      "aliases": [
        "信使"
      ],
      "kind": "person",
      "static_description": "A local courier; a distinct person from the archivist.",
      "source_refs": [
        "example-source"
      ]
    }
  ],
  "initial_state": {
    "at": {
      "day": 0,
      "minute": 480
    },
    "facts": [
      {
        "fact": {
          "entity_id": "planet",
          "predicate": "exists",
          "value": true
        },
        "source_refs": [
          "example-source"
        ],
        "note": "Baseline fact."
      },
      {
        "fact": {
          "entity_id": "mira",
          "predicate": "alive",
          "value": true
        },
        "source_refs": [
          "example-source"
        ],
        "note": "Baseline fact."
      },
      {
        "fact": {
          "entity_id": "conflict",
          "predicate": "active",
          "value": false
        },
        "source_refs": [
          "example-source"
        ],
        "note": "Baseline fact."
      },
      {
        "fact": {
          "entity_id": "council",
          "predicate": "broadcast",
          "value": false
        },
        "source_refs": [
          "example-source"
        ],
        "note": "Baseline fact."
      },
      {
        "fact": {
          "entity_id": "harbor",
          "predicate": "festival_held",
          "value": false
        },
        "source_refs": [
          "example-source"
        ],
        "note": "Baseline fact."
      },
      {
        "fact": {
          "entity_id": "old-market",
          "predicate": "condition",
          "value": "intact"
        },
        "source_refs": [
          "example-source"
        ],
        "note": "Synthetic baseline; later effects do not erase their establishing occurrences."
      },
      {
        "fact": {
          "entity_id": "archive-key",
          "predicate": "holder",
          "value": "archivist"
        },
        "source_refs": [
          "example-source"
        ],
        "note": "Synthetic baseline; later effects do not erase their establishing occurrences."
      }
    ]
  },
  "arcs": [
    {
      "id": "harbor-conflict",
      "title": "Harbor conflict",
      "summary": "A branching route around two fixed milestones.",
      "event_ids": [
        "medic-ambush",
        "council-broadcast",
        "conflict-begins",
        "harbor-festival",
        "conflict-ends"
      ]
    }
  ],
  "events": [
    {
      "id": "medic-ambush",
      "title": "Ambush of Mira",
      "summary": "In the unmodified example history, Mira dies in an ambush.",
      "classification": "FREE",
      "required_description": null,
      "when": {
        "earliest": {
          "day": 1,
          "minute": 600
        },
        "latest": {
          "day": 1,
          "minute": 600
        },
        "precision": "minute",
        "label": "Day 1, 10:00",
        "basis": "editorial",
        "notes": "Synthetic example timing; not a date from any published franchise."
      },
      "entity_ids": [
        "mira",
        "council"
      ],
      "location_ids": [
        "harbor"
      ],
      "arc_id": "harbor-conflict",
      "canonical_preconditions": {
        "all": [
          {
            "fact": {
              "entity_id": "mira",
              "predicate": "alive",
              "value": true
            }
          },
          {
            "fact": {
              "entity_id": "planet",
              "predicate": "exists",
              "value": true
            }
          }
        ]
      },
      "outcomes": [
        {
          "entity_id": "mira",
          "predicate": "alive",
          "value": false
        }
      ],
      "canonical_effects": [
        {
          "op": "set",
          "fact": {
            "entity_id": "mira",
            "predicate": "alive",
            "value": false
          }
        }
      ],
      "visibility": {
        "mode": "public",
        "knower_ids": []
      },
      "participation": {
        "offer": "when_relevant",
        "hook": "Offer a local opportunity only if the player can plausibly observe or influence this event."
      },
      "source_refs": [
        "example-source"
      ],
      "author_note": "Author-chosen example classification."
    },
    {
      "id": "council-broadcast",
      "title": "Council broadcast",
      "summary": "The council broadcasts a grievance that contributes to the conflict.",
      "classification": "SOFT",
      "required_description": null,
      "when": {
        "earliest": {
          "day": 1,
          "minute": 720
        },
        "latest": {
          "day": 1,
          "minute": 720
        },
        "precision": "minute",
        "label": "Day 1, 12:00",
        "basis": "editorial",
        "notes": "Synthetic example timing; not a date from any published franchise."
      },
      "entity_ids": [
        "council",
        "conflict"
      ],
      "location_ids": [
        "harbor"
      ],
      "arc_id": "harbor-conflict",
      "canonical_preconditions": {
        "all": [
          {
            "occurred": "medic-ambush"
          },
          {